{
  "meta": {
    "slug": "militarizacion",
    "titulo": "Guerra sin declarar",
    "subtitulo": "Desde el 17 de enero de 2026, estructuras militares gobiernan funciones civiles en Cuba sin que el Estado haya proclamado ninguna de las situaciones excepcionales que prevé su propia Constitución: 215 eventos documentados por Cubalex entre febrero y julio, un civil procesado por espionaje ante un tribunal militar y amenazas de muerte contra presos políticos.",
    "descripcion": "El 17 de enero de 2026, el Consejo de Defensa Nacional de Cuba celebró una sesión presentada por la prensa oficial como una actividad rutinaria del Día de la Defensa. En ella aprobó \"los planes y medidas para el paso al Estado de Guerra\". Dos días después, los principales voceros del sistema estatal de medios negaron por su cuenta que se hubiera declarado un estado de guerra, calificando lo aprobado de \"acto administrativo y preventivo\". Ningún órgano del Estado ha proclamado formalmente una situación excepcional desde entonces. Ninguna medida tiene fecha de terminación. Ningún tribunal supervisa lo que se decide.\n\nEste expediente documenta, con datos del informe especial de Cubalex \"Cuba: militarización social y excepcionalidad de facto\" (corte de datos: 25 de julio de 2026) y verificación independiente propia, cómo esa contradicción entre lo que el Estado hace y lo que proclama se sostuvo y se profundizó durante seis meses. Cubalex registra 215 eventos entre el 3 de febrero y el 24 de julio, con una composición que se invirtió con el tiempo: en febrero, el 20% de los eventos era represión directa; en junio y julio, esa proporción subió a 80% y 79%. La escala de riesgo de militarización social de Cubalex, de 1 a 5, se mantiene en el nivel máximo desde abril de 2026.\n\nEl periodo dejó hechos verificados de forma independiente que superan la retórica. El humorista Eduardo Ceballos fue detenido el 1 de junio por un video satírico grabado en una base militar abandonada; días después se anunció que sería procesado por un tribunal militar acusado de espionaje, delito que en su modalidad más grave alcanza 30 años de prisión. Presos políticos como Alexander Verdecia y expresos como Andy García Lorenzo recibieron amenazas de muerte directas de funcionarios estatales. El opositor Manuel Cuesta Morúa fue detenido de forma incomunicada y denunció golpes tras su liberación. El hábeas corpus presentado a favor del artista Luis Manuel Otero Alcántara fue denegado y obstaculizado repetidamente por tribunales en Artemisa y La Habana, hasta que la resolución final llegó una semana después de que ya hubiera salido de Cuba. La Resolución 6/2026 del Ministerio del Interior, publicada en la Gaceta Oficial el 18 de mayo, autoriza congelar cuentas bancarias sin aviso previo y sin límite temporal.\n\nEste expediente separa con cuidado dos niveles de evidencia. Los hechos y casos individuales narrados aquí (la sesión del Consejo de Defensa Nacional y su desmentido, la Resolución 6/2026, la campaña \"Mi Firma por la Patria\", la restricción de viajes interprovinciales y los cinco casos documentados) fueron corroborados de forma independiente por un subagente de verificación contra prensa cubana, la Gaceta Oficial y organizaciones de derechos humanos. Las dos series numéricas agregadas —eventos mensuales y protestas mensuales— son, en cambio, la métrica interna del propio monitoreo de Cubalex: no existe una réplica exacta en otro observatorio, y la serie de protestas en particular diverge de las cifras publicadas por el Observatorio Cubano de Conflictos (OCC) para los mismos meses. Se presentan igualmente, porque documentan una tendencia consistente con los hechos verificados de forma independiente, pero marcadas de forma visible como \"según Cubalex\", nunca como una segunda fuente que las confirme.\n\nLa evaluación jurídica de este expediente aplica los cinco requisitos que el derecho internacional de los derechos humanos exige a cualquier estado de excepción legítimo —proclamación, límite temporal, necesidad y proporcionalidad, notificación internacional y control judicial efectivo— sobre los hechos verificados de forma independiente. Los cinco aparecen incumplidos.",
    "narracion": "Desde el diecisiete de enero de dos mil veintiséis, Cuba opera bajo estructuras militares que asumen funciones civiles sin que el Estado haya declarado formalmente ningún estado de excepción. Ese día, el Consejo de Defensa Nacional aprobó los planes para el paso al Estado de Guerra. Dos días después, la televisión estatal negó que existiera tal declaración. Ninguna medida tiene fecha de fin. Ningún tribunal la supervisa. Cubalex documentó doscientos quince eventos entre febrero y julio, con una escala de riesgo que se mantiene en el nivel máximo, de cinco, desde abril. El humorista Eduardo Ceballos enfrenta un tribunal militar por espionaje, por un video satírico. Presos políticos recibieron amenazas de muerte directas. El hábeas corpus del artista Luis Manuel Otero Alcántara fue denegado varias veces, hasta que la resolución llegó una semana después de que ya hubiera salido del país. Una resolución ministerial permite congelar cuentas bancarias sin aviso previo. Este expediente verificó de forma independiente cada caso y cada norma citada. Las cifras mensuales de eventos y protestas, en cambio, son la métrica propia de Cubalex, sin réplica exacta en otro observatorio, y se presentan marcadas como tal. Los cinco requisitos internacionales para un estado de excepción legítimo (proclamación, límite temporal, proporcionalidad, notificación y control judicial) aparecen, los cinco, incumplidos.",
    "version": "1.0.0",
    "fecha_datos": "2026-07-25",
    "advertencia": "Los hechos y casos individuales de este expediente están corroborados por fuentes independientes de Cubalex. Las series mensuales de eventos y de protestas son la métrica interna del propio monitoreo de Cubalex: la serie de protestas, en particular, diverge de las cifras del Observatorio Cubano de Conflictos (OCC) para los mismos meses. Se presentan marcadas como \"según Cubalex\", nunca como corroboradas por una segunda fuente."
  },
  "intro": {
    "parrafos": [
      "El 17 de enero de 2026, el Consejo de Defensa Nacional aprobó \"los planes y medidas para el paso al Estado de Guerra\". Dos días después, la televisión estatal negó que se hubiera declarado un estado de guerra. Desde entonces, ningún órgano del Estado ha proclamado formalmente una situación excepcional, ninguna medida tiene fecha de terminación y ningún tribunal supervisa lo que se decide.",
      "Entre febrero y julio de 2026, Cubalex documentó 215 eventos que muestran cómo esa contradicción se sostuvo: la composición del registro se invirtió (de 20% de represión directa en febrero a 79-80% en junio y julio) y la escala de riesgo de militarización social se mantiene en su nivel máximo desde abril.",
      "Este expediente distingue siempre dos niveles de evidencia: los hechos y casos individuales, verificados de forma independiente contra prensa cubana y fuentes oficiales, y las dos series numéricas agregadas, que son la métrica propia de Cubalex y se presentan marcadas como tal, sin fusionarlas con lo corroborado por segunda fuente."
    ]
  },
  "origen": {
    "fecha": "17 de enero de 2026",
    "hechos": [
      {
        "afirmacion": "El Consejo de Defensa Nacional celebró una sesión, presentada por la prensa oficial como una actividad del Día de la Defensa, en la que aprobó \"los planes y medidas para el paso al Estado de Guerra, como parte de la preparación del país bajo la concepción estratégica de la Guerra de todo el Pueblo\".",
        "confianza": "corroborada",
        "fuente": "Presidencia de Cuba / Granma / Cubadebate (17 de enero de 2026)"
      },
      {
        "afirmacion": "La noche del 18 y la mañana del 19 de enero, los principales voceros del sistema estatal de medios negaron que se hubiera declarado un estado de guerra, calificando lo aprobado de \"acto administrativo y preventivo\".",
        "confianza": "corroborada",
        "fuente": "CiberCuba, elTOQUE, Telemundo 51 (19 de enero de 2026)"
      },
      {
        "afirmacion": "Una semana antes de la sesión, la Presidencia había tenido que desmentir un comunicado falso que anunciaba la suspensión de todas las actividades del país.",
        "confianza": "corroborada",
        "fuente": "Cubadebate, Presidencia de Cuba (11 de enero de 2026)"
      }
    ],
    "cita_oficial": {
      "texto": "Un acto administrativo y preventivo: actualizar manuales de logística, movilización y defensa.",
      "atribucion": "Explicación oficial difundida por el Sistema Informativo de la Televisión Cubana",
      "fecha": "19 de enero de 2026",
      "confianza": "corroborada",
      "fuente": "CiberCuba, Canal Caribe"
    }
  },
  "fases": [
    {
      "id": "organizacion",
      "periodo": "Febrero 2026",
      "titulo": "Organización",
      "descripcion": "Activación de Zonas de Defensa y Milicias de Tropas Territoriales, con integración de la población civil en tareas de vigilancia local.",
      "hechos_clave": ["10 eventos registrados, 3 provincias, 20% de represión directa."]
    },
    {
      "id": "operativo",
      "periodo": "Marzo 2026",
      "titulo": "Operativo",
      "descripcion": "Los despliegues militares responden a un récord histórico de protestas provocadas por el colapso del sistema eléctrico nacional.",
      "hechos_clave": ["33 eventos registrados, 9 provincias, 234 protestas según Cubalex — el mes de mayor número de protestas hasta entonces."]
    },
    {
      "id": "consolidacion",
      "periodo": "Abril 2026",
      "titulo": "Consolidación",